Bank,State,City,Branch,Address,Pincode,Latitude,Longitude
CSL Finance,Delhi -NCR,CORPORATE OFFICE,CORPORATE OFFICE,"CORPORATE OFFICE CSL FINANCE LIMITED Unit no. 716,717, 7th Floor,World Trade Tower, Sector 16,  Noida, Uttar Pradesh -  201301",201301,28.5767307281494,77.3168792724609
CSL Finance,Delhi -NCR,Karol Bagh,Karol Bagh,"CSL FINANCE LIMITED office -410-412, 18/12, 4th Floor, W.E.A. Arya Samaj Road Karol Bagh, New Delhi -110005",110005,,
CSL Finance,Delhi -NCR,Gurugram,Gurugram,"Gurugram CSL FINANCE LIMITED Shop No 144/7, 1st Floor, Verma Tower Bhim Nagar Chowk, Near Railway Road Gurugram, Haryana-122001",122001,,
CSL Finance,Delhi -NCR,Noida,Noida,"Noida CSL FINANCE LIMITED Khata no.-451, First floor, Sharma Market, Hoshiyarpur, Hoshiarpur Village, sector-51, Noida, Uttar Pradesh 201301",201301,,
CSL Finance,Delhi -NCR,Laxmi Nagar,Laxmi Nagar,"Laxmi Nagar CSL FINANCE LIMITED Office No. 301, 2nd Floor,Bhogal Complex, Plot No.3, Veer Savarkar Block, ​​​Shakarpur, Delhi-110092",110092,,
CSL Finance,Gujarat,Ahmedabad,Ahmedabad,"Ahmedabad CSL FINANCE LIMITED Office No. SF - 201, City Centre Arcade & Home NR. SRP Campus, Krishnanagar – Naroda Highway, Naroda, Ahmedabad - Gujarat-382346.",382346,,
CSL Finance,Gujarat,Baroda,Baroda,Baroda CSL FINANCE LIMITED Csl Finance Limited Office NO/TF-307 Earth The Land Mark OPP.Satsang Party Plot Sun Pharma Road Vadodara – Gujarat- 390012,390012,,
CSL Finance,Gujarat,Bharuch,Bharuch,"Bharuch Premises No - T-06, Golden Square, Near D Mart, Old NH, ABC Chowkadi, Bharuch, Gujarat, 392001 .",392001,,
CSL Finance,Gujarat,Mahesana,Mahesana,"Mahesana CSL FINANCE LIMITED Shop No. T-8, 3rd Floor, Orbit Small Center, Near Dena   Bank, Radhanpur Curcle, Mehsana, Gujrat - 384002.",384002,,
CSL Finance,Gujarat,Siddhpur,Siddhpur,"Siddhpur CSL Finance Ltd - Office No. F-1, 1st Floor, Pramukh Plaza Sidhpur, Siddhraj Jaisinh Rd, near Laxmi Market, Patan, Gujarat 384151",384151,,
CSL Finance,Gujarat,Surat,Surat,"Surat CSL FINANCE LIMITED office No- 109,Palash Palladia, Near Galaxy Circle, Green   City Road, Pal, Surat, Gujarat - 395009",395009,,
CSL Finance,Gujarat,Navsari,Navsari,"Navsari CSL FINANCE LIMITED Shop no. 306, 3rd  Floor, Sai Darbar Boltigor chhapra Road B/H Technical School, Navsari- Gujarat - 396445",396445,,
CSL Finance,Gujarat,Anand,Anand,"Anand CSL FINANCE LIMITED T/6, 3rd   Floor, Radha Arcade, Opposite Indrapuri Society, Lambhvel Road, Near Indira   Statue, Anand, Gujarat – 388001",388001,,
CSL Finance,Gujarat,Dahegam,Dahegam,"Dahegam CSL FINANCE LIMITED Premises No 315/316, Balmukund Square, opp. Amin Society, Darshan Society, GIDC, Dahegam, Gujarat 382305",382305,,
CSL Finance,Gujarat,Himatnagar,Himatnagar,"Himatnagar CSL FINANCE LIMITED Shop No – 124, 1st Floor, One world, Polytechnic college Cross Road , Shamlaji highway, Motipura, Himatnagar, Sabarkantha, Gujarat - 383001",383001,,
CSL Finance,Gujarat,Vapi,Vapi,"Vapi CSL FINANCE LIMITED Shop No - 305, (TF-05), Third Floor, Girnar khusboo plaza, Opp. Vishal mega mart, Near Reliance Smart Mall, G I D C, Vapi, Dist. Valsad, Gujarat - 396195",396195,,
CSL Finance,Haryana,Sonipat,Sonipat,"Sonipat CSL FINANCE LIMITED, Corner Building   No. B-1, Second Floor, Indira Colony, Railway Station Gohana Road, Opp. HDFC   Bank - Sonipat - Haryana - 131001",131001,,
CSL Finance,Haryana,Ambala,Ambala,"Ambala CSL   FINANCE LIMITED SCO 91,2nd floor Prem Nagar, Above Bajaj Finance Ambala city   HR 134003",134003,,
CSL Finance,Haryana,Karnal,Karnal,"Karnal CSL FINANCE LIMITED Sco 150, First Floor, Mugal Canal Road, Karnal, Haryana-132001",132001,,
CSL Finance,Haryana,Panipat,Panipat,"Panipat CSL   FINANCE  LIMITED Shop No. 17, 2nd Floor, Mahabir Colony, B.M.K Market,   Behind Hive Hotel, G.T Road, Panipat, Haryana - 132103",132103,,
CSL Finance,Haryana,Faridabad,Faridabad,"Faridabad CSL FINANCE LIMITED Shop No - 128, Plot No 69,70,71 First Floor, Om Shubham Tower, Situated at Neelam Bata Road, NIT Faridabad Haryana - 121001",121001,,
CSL Finance,Haryana,Yamuna Nagar,Yamuna Nagar,"Yamuna Nagar CSL FINANCE LIMITED SCO - 179,  1st Floor, Sec 17, Jagadhari, Yamuna Nagar, Haryana - 135003",135003,,
CSL Finance,Punjab,Ludhiana,Ludhiana,"Ludhiana CSL Finance Limited, 1st Floor, SCO-15, San Plaza Building Feroze Gandhi Market Ludhiana Punjab -141001",141001,,
CSL Finance,Punjab,Patiala,Patiala,"Patiala CSL Finance Limited, Premises No- 2nd Floor SCO-15 New Leela Bhawan Market Patiala Punjab-147001",147001,,
CSL Finance,Punjab,Rajpura,Rajpura,"Rajpura Shop No.   15-C, Second Floor, Calibre Market, Patiala Road, Rajpura- Punjab –   140401. Click Me",140401,,
CSL Finance,Rajasthan,Ajmer,Ajmer,"Ajmer CSL FINANCE LIMITED AMC No. 419/11=463/10 , Part 2 & 3, Brahampuri, Ajmer –   Rajasthan -305001",305001,,
CSL Finance,Rajasthan,Jaipur,Jaipur,"Jaipur CSL FINANCE LIMITED Office No. Office No. 104, 1st Floor, ARG Complex, Sikar road, Jaipur, Rajasthan -302013",302013,,
CSL Finance,Rajasthan,Udaipur,Udaipur,Udaipur CSL FINANCE LIMITED Office   No. 205 2nd Floor Icon Tower Madhuban Udaipur- Rajasthan 313001,313001,,
CSL Finance,Rajasthan,Sikar,Sikar,"Sikar CSL FINANCE LIMITED Office No 01, 3rd Floor Ocean Plaza, Near Maruti Showroom, Jaipur Road, Sikar, Rajasthan -332001",332001,,
CSL Finance,Rajasthan,Rajsamand,Rajsamand,"Rajsamand CSL FINANCE LIMITED 1st Floor, Below Nataraj Namkeen, Near Sharma hospital,   Nathdwara Rd, opp. SBI ATM, Kankroli, Rajsamand -313324",313324,,
CSL Finance,Rajasthan,Srimadhopur,Srimadhopur,"Srimadhopur CSL FINANCE LIMITED Premises No Ward no 20, 1st Floor, Lucky Plaza Station Road Near Vrindavan Mart, Shrimadhopur, Sikar, Rajasthan - 332715",332715,,
CSL Finance,Rajasthan,Jobner,Jobner,"Jobner CSL FINANCE LIMITED Shop no 8 ,S.G. Plaza, Naga circle, Jobner bypass ,Jobner ,Jaipur ,Pin -303328",303328,,
CSL Finance,Rajasthan,Udaipurwati,Udaipurwati,"Udaipurwati CSL Finance Limited, Premises No 1st Floor,Near Ghumchakkar and AU Bank, Jhunjhunu Road, Udaipurwati,  Rajasthan -   333307",333307,,
CSL Finance,Rajasthan,Chittorgarh,Chittorgarh,"Chittorgarh CSL   Finance Limited, Premises No – Ground Floor ,C-3, Mohan Enclave, Meera Nagar,   Chittorgarh, Rajasthan - 312001",312001,,
CSL Finance,Rajasthan,Bhilwara,Bhilwara,"Bhilwara CSL   Finance Limited, Premises No – Shop No. 213, 2nd floor, BTC Complex, in front   of Harsh Palace Hotel, Old RTO Road, Bhilwara - 311001 (Raj.)",311001,,
CSL Finance,Rajasthan,Dausa,Dausa,"Dausa CSL Finance Limited, Shop No 26, 1st Floor, First Tower Building, Agra Road, Dist. Dausa, Near PG Collage Dausa, Rajasthan – 303303",303303,,
CSL Finance,Rajasthan,Kuchaman,Kuchaman,"Kuchaman CSL Finance Limited, Shop No - 102, 1st Floor, Rathi Complex, Didwana Rd, Kuchaman City, Rajasthan 341508.",341508,,
CSL Finance,Uttar Pradesh,Agra,Agra,Agra CSL FINANCE LIMITED Office   57/2 unit no 14 second floor kaveri building Sanjay place Agra pin- 282002,282002,,
CSL Finance,Uttar Pradesh,Mathura,Mathura,"Mathura CSL FINANCE LIMITED
Premises No ,Office no – G 17 A,  1st floor, Kaushiki Tower Opposite Roadways Workshop, Mathura, Uttar Pradesh - 281001",281001,,
CSL Finance,Uttarakhand,Dehradun,Dehradun,"Dehradun CSL   Finance Limited 92/72,   3rd Floor  Vrindavan Tower, New Cantonment Rd, Hathibarkala, Dehradun,  Uttarakhand 248001",248001,,
CSL Finance,Uttarakhand,Haridwar,Haridwar,"Haridwar CSL   Finance Limited Kumar’s building , shop no :-7 first floor , Ram Nagar  Colony Jwalapur , Haridwar 249407",249407,,
