Bank,State,City,Branch,Address,Pincode,Latitude,Longitude
Sammaan Capital,Gujarat,Jamnagar,Jamnagar(Shreeji_Imperia_Dst),"Shreeji Imperia,1St Floor, Park Colony Main Road - 361001",361001,,
Sammaan Capital,Haryana,Bhiwani,Bhiwani(Crown_Plaza),"Shop No.301,Ist Floor,Crown Plaza,Sector Urban Estate,Circular Road, - 127021",127021,,
Sammaan Capital,Uttar Pradesh,Mathura,Mathura(Radhika_Vihar),"Ground Floor,Part Of B-15, Radhika Vihar Phase-2, Near Highway Plaza - 281001",281001,,
Sammaan Capital,Maharashtra,Nashik,Nashik(Gangapur_Road),"Office No.500-501,5Th Floor, Survey No.715/A/4/2, Plot No.5,Shree Ganesh Kuber, - 422005",422005,,
Sammaan Capital,Telangana,Nizambad,Nizambad(Kanteshwar),"Trade,Kanteshwer 1St Floor,Sri Sai Traders,Beside Indur - 503002",503002,,
Sammaan Capital,Gujarat,Ahmedabad,Ellisbridge_Radhika House_1St Floor,1St Floor Radhika Opp. Mayor'S Bungalow Law Garden Ellisbridge - 380006,380006,,
Sammaan Capital,Gujarat,Gujarat,Gandhinagar(White_House),"304,3Rd Floor,White House,Sector 11 - 382010",382010,,
Sammaan Capital,Madhya Pradesh,"Pithampur,dhar",Pithampur(Sudarshan_Complex),"Dugf-44,First Floor,Sudarshan Complex, Mhow-Neemuch Road, - 454775",454775,,
Sammaan Capital,Rajasthan,Jaipur,Jaipur(Shahpura),"Ground Floor, Palsaniya Paradise, Nh 8,Shahpura, - 303103",303103,,
Sammaan Capital,Rajasthan,Jaipur,Jaipur(Ashok_Marg_1St_Floor),"First Floor, Ashok Marg, C-Scheme - 302001",302001,,
Sammaan Capital,Pondicherry,Pondycherry,Pondicherry(Laxmi_Towers),"Kamraj Salai Thattanchavady, No: 72,Lakshmi Towers, - 605009",605009,,
Sammaan Capital,Uttar Pradesh,Raebareilly,Raebareilly(Shri_Vinayak_Complex),"Shri Vinayak Complex,2Nd Floor,Commercial Plot No 2 Firoz Gandhi Nagar Vyosayik Yojna Civil Lines,Raebareilly - 229001",229001,,
Sammaan Capital,Madhya Pradesh,Satna,Satna(Tiwari_Tower),"Shop No. 103, Situated At 2Nd Floor, Above Axis Bank Tiwari Tower, Reva Raod, - 485001",485001,,
Sammaan Capital,Telangana,Hyderabad,Hyderabad(Uppal),"Survey No.590/Aa,2Nd Floor, Saraswathi Colony, Uppal Main Rd, Uppal Kalan Village, - 500039",500039,,
Sammaan Capital,Karnataka,Hubli,Kalburgi Noolvi Avenue,"1St Floor, Cts No. 122/151 A, Ward Iii, Kalburgi Noolvi Avenue, New Cotton Market, - 580029",580029,,
Sammaan Capital,Gujarat,Rajkot,Rajkot(Nanamava),"Shop No. 105, Ist Floor Of Solitaire Plot No. 196P, T.P. Scheme No. 3, Survey No. 70 P, Village Nanamava - 360005",360005,,
Sammaan Capital,Karnataka,Bengaluru,Bengaluru(R_S_Twr_Electronic_City),"3Rdfloor, R.S Tower, S.No.55, Hosur Main Hebbagodi, Anekal Tq, Electronic City, - 560099",560099,,
Sammaan Capital,Rajasthan,Pali,Pali(Chandel_Plaza),"1St Floor Plot No. 2, Chandel Plaza, Near Mastan Baba Sumerpur Road - 306401",306401,,
Sammaan Capital,Punjab,Ludhiana,Ludhiana(Fortune Chanbers 1St Fr),"1St Floor, Fortune Chambers Sco 16-17 Feroze Gandhi Market - 141001",141001,,
Sammaan Capital,Karnataka,Davanagere,Davanagere(Kbi_Towers),"1967/18,Kbi Towers,2Nd Floor,B Block, Near Ring Road Circle, Ss Layout, - 577005",577005,,
Sammaan Capital,Punjab,Amritsar,Amritsar(Kk_Tower),"Kk Towers, Sco 31, First Floor , Distt.Shopping Centre Ranjit Avenue - 143001",143001,,
Sammaan Capital,Rajasthan,Tonk,Tonk(Frozan_Building),"Talaab Road Frozan Building,1St Floor,Subhash Bazaar - 304001",304001,,
Sammaan Capital,Telangana,Hyderabad,Hyderabad(Kphb_Colony),"2Nd Floor, Plot No. 1, Hig, Sy. No.:1009, Door No.: 15-31 Vh-Op-1, Phase V, Kphb Colony, - 500072",500072,,
Sammaan Capital,Haryana,Karnal,Mall Road_Shakti Colony_1St Floor,"Shop.1 Shakti Colony, 1St Floor, Mall Road - 132001",132001,,
Sammaan Capital,Delhi,New delhi,"4Th Floor, Rohini",4Th Floor 401 To 407 Nn Mall N-15 Manglam Place Sector-3 Rohini - 110085,110085,,
Sammaan Capital,Uttarakhand,Haldwani,Haldwani(Grd_Tower),"2Nd Floor,Guru Ram Das Tower, Nainital Road,Haldwani - 263139",263139,,
Sammaan Capital,Karnataka,Chitradurga,Chitradurga(B_T_Road),"1St Floor, Radhakrishna Arcade, B.T Road North Side, - 577501",577501,,
Sammaan Capital,Gujarat,Mahesana,Mehsana(Rajkamal_City_Mall),"1St Floor,Rajkamal City Mall, Rajkamal City Mall Rajkamal Campus Near Rajkamal Petrol Pump Highway Road - 384002",384002,,
Sammaan Capital,Uttar Pradesh,Noida,Sec-63,"1St Floor,B-4,Sec-63, Noida - 201301",201301,,
Sammaan Capital,Uttarakhand,"Roorkee,",Roorkee(Chow_Mandi),"1St Floor,1410 Chow Mandi,Malviya Chowk, Dehradun Road - 247667",247667,,
Sammaan Capital,Rajasthan,Udaipur,Udaipur(Madhuban_Bussiness_Center),"Office No.G-1,G-2,G-3 And G-4, Ground Floor(Front Side), ""Business Center"",Madhuban, - 313001",313001,,
Sammaan Capital,Karnataka,Belgaum,Belgaum(Star_Tower),"F-11, 1St Floor, Cts No. 8/1, 8/2, 8/3, Khanapur Road, Tilakwadi, Belgaum-9 - 590006",590006,,
Sammaan Capital,Telangana,Hyderabad,Hyderabad(Banjara Hills),"Property No.6-3-334/1,3Rd Floor Park City Plaza, Dwarkapuri Colony Road No.1,Banjara Hills - 500034",500034,,
Sammaan Capital,Rajasthan,Dungarpur,Dungarpur(Oppsite_Bus_Stand),"1St Floor, Front Side Oppsite Bus Stand Near Axis Bank, - 314001",314001,,
Sammaan Capital,Madhya Pradesh,Ujjain,Ujjain(Aditya_Plaza),"Shop No. 102,2Nd Floor, Aditya Plaza,P.No.34/35, Kamla Nehru Marg, - 456010",456010,,
Sammaan Capital,Gujarat,Anand,Anand(Amul_Dairy_Road),"Shop No. 101,Maruti Sunand, F.P. No. 152/1, T.P. Scheme No. 2, Amul Dairy Road, - 388001",388001,,
Sammaan Capital,Rajasthan,Ajmer,Ajmer(Shantipura),"2Nd Floor, Plot Bearing No.02 (First Part), Ashok Vihar Colony, Near Hotel Man Singh, Shantipura, - 305004",305004,,
Sammaan Capital,Madhya Pradesh,Ratlam,Ratlam(Freeganj),"2Nd Floor,Floor, Plot Bearing Mu.No.102&103, Freeganj,Motilal Nehru Marg, - 457001",457001,,
Sammaan Capital,Madhya Pradesh,Bhopal,Bhopal(M.P.Nagar_Dst),"The Infinity"", 2Nd Floor 249, M.P. Nagar Zone-Ii, Adjucent To Hotel Tulsi Exotis - 462011",462011,,
Sammaan Capital,Haryana,Bahadurgarh,Bahadurgarh(Delhi_Rohtak_Road),"Ist Floor (Above Woodland Showroom), Khasra No.2368/2/1,2373,2382/2, Delhi-Rohtak Road - 124507",124507,,
Sammaan Capital,Delhi,New delhi,Newdelhi(Shakkarpur),"Plot No. Mb-160 A&B, 2Nd Floor, Shakkarpur, - 110092",110092,,
Sammaan Capital,Haryana,Faridabad,Faridabad(Bhadana_Complex),"2Nd Floor,Bp-47,Bhadana Complex, Neelam Bata Road, Nit - 121001",121001,,
Sammaan Capital,Rajasthan,Kankroli,Rajsamand(Gs_Empire),"100 Ft. Road 1St Floor ,Gs Empire, Opposite Hdfc Bank - 313324",313324,,
Sammaan Capital,Punjab,Ludhiana,Khanna(Purewal_Tower),"2Nd Floor,Purewal Tower, Samrala Chowk, - 141401",141401,,
Sammaan Capital,Uttar Pradesh,Aligarh,Aligarh(Ramghat_Road),"J-77,Second Floor,Sm Complex, Ramghat Road, - 202001",202001,,
Sammaan Capital,Rajasthan,Hanumangarh,Hanumangarh(Chak_3),"Part Of Killa No.12, Ground Floor,Chak 3, K.H.J.,S.No. 119/259, Near Au Small Finance Bank, Sgnr Road, Dhilon Colony - 335512",335512,,
Sammaan Capital,Maharashtra,Mumbai,Boisar(Ostwal_Empire),"Shop No. 6,7 & 8, 1St Floor, Ostwal Empire Office Building, Near Big Bazar, Plot Bearing S. No. 111/A-2, 111/1/2 & 111A/1/1, Boisar, Pal - 401501",401501,,
Sammaan Capital,Haryana,Jind,Jind(Sco-12),"Sco-12,District Shopping Complex, Urban Estate, - 126102",126102,,
Sammaan Capital,Uttar Pradesh,Prayagraj,Prayagraj(Vinayak_Tower),"E1 20,M G Marg,Civil Lines Vinayak Tower,Portion Of 2Nd Floor,124 - 211002",211002,,
Sammaan Capital,Rajasthan,Dausa,Dausa(Saraswati_Nagar),"Plot No. F/190/1, Khasra No. 1578, 1St Floor Saraswati Nagar Yojna, - 303303",303303,,
Sammaan Capital,Uttarakhand,Dehradun,Dehradun(Krishna_Plaza),"69,Ist Floor, Krishna Plaza,Rajpur Road, - 248001",248001,,
Sammaan Capital,Uttar Pradesh,Bulandshahar,Bulandshahar(D_M_Road),"4C-1/6,Avas Vikas Colony 1,D M Road - 203001",203001,,
Sammaan Capital,Andhra Pradesh,Nellore,Nellore(Mmr_Complex),"First Floor,26-3-6367,Padarupalli,Mini Bypass Road, - 524004",524004,,
Sammaan Capital,West Bengal,Kolkata,Kolkata(Kankaria_Centre),"Office No.6,3Rd Floor (Back Side), ?Kankaria Centre?,Plot No.2/1, Russell Street - 700071",700071,,
Sammaan Capital,Karnataka,Bengaluru,Bengaluru(Sahakarnagar),"No.508,1St Floor, 'Medini' 60Ft Road, F Block, Sahakarnagar, - 560092",560092,,
Sammaan Capital,Maharashtra,Satara,Satara(Sadarbazar),"F-1,1St Floor,Raja Bhosale Heights, Opp.Satara Bus Stand,Sadarbazar, - 415001",415001,,
Sammaan Capital,Uttar Pradesh,Ghaziabad,Kaushambi(Sec-14),"Ist&2Nd Floor,Commercial Complex, Plot No.3,Sec-14,Kaushambi, - 201012",201012,,
Sammaan Capital,Maharashtra,Pune,Pune(Pimpri_Msr_Capital_12&13),"Msr Capital, Near Morwadi Court, Pimpri, Office No. 12 & 13, 3Rd Floor, - 411018",411018,,
Sammaan Capital,Uttar Pradesh,Saharanpur,"Padma Plaza, Sahranpur","(Near Vishal Mega Mart) 1St Floor, Padma Plaza Commercial Plot No.1 Avas Vikas Delhi Road, - 247001",247001,,
Sammaan Capital,Gujarat,Gandhidham,Gandhidham(Rajdeep_Complex),"Office No. ? 6,Ist Floor,Rajdeep Complex, Plot -15,Sector-9/A,Gandhidham-Kutch - 370201",370201,,
Sammaan Capital,Uttar Pradesh,Noida,Noida(Sec_18_Som_Dutt_Tower),"Office No.701,7Th Floor ?Som Datt Tower? Property/Plot No. K-2,Sector -18 - 201301",201301,,
Sammaan Capital,Punjab,Patiala,Patiala(W_Tower),"Sco-81,82,1St Floor, New Leela Bhawan - 147001",147001,,
Sammaan Capital,Rajasthan,Jodhpur,Jodhpur(Gulandi_Bhawan),"Office No.9A/B,1St Floor,Gulandi Bhawan, Ratnada,Police Line Road - 342001",342001,,
Sammaan Capital,Maharashtra,Mumbai,Mumbai(Kalyan_Sahjanand_Chowk),"Office No.3(5,6&7),2Nd Floor, Ram Krishna Bhavan, Above Icici Bank,Sahajanand Chowk, Kalyan(W),Thane, - 421301",421301,,
Sammaan Capital,Haryana,Hisar,Hisar(Sco-71-72_Red_Square_Market),"1St Floor, Sco 71-72, Kamla Nagar, Red Square Market, - 125001",125001,,
Sammaan Capital,Uttar Pradesh,Agra,Agra(Vidhya_Nagar),"Ist Floor,Chanssuria Complex,Plot No.31, Khasra No. 71,Shastripuram Crossing, Mauza Dehtora,Vidhya Nagar,Sikandra - 282007",282007,,
Sammaan Capital,Gujarat,Ahmedabad,Ahmedabad(Radhika_4Th _Floor),Near Pantaloon Opp. Mayor Law Garden Ellisbridge 4Th Floor Radhika House - 380006,380006,,
Sammaan Capital,Rajasthan,Jaipur,Ashok Marg,"P.No.O-12 B, Ground Floor, Ashok Marg, C-Scheme, - 302001",302001,,
Sammaan Capital,Maharashtra,Nagpur,Nagpur(Kamptee_Road),"Jesus Calls Building, 1St Floor Besides Patni Automobiles Khampti Road, Sadar - 440001",440001,,
Sammaan Capital,Uttar Pradesh,Meerut,"Krishna Plaza, Opp. Choudhry Charan","Shop No. 101, 102, 103 & 104, Paergarh Chauraha, Garh Road, 1St Floor,Krishna Plaza,Opp.C.C.S.U - 250002",250002,,
Sammaan Capital,Delhi,New delhi,New Delhi(Pusa_Road),"Ugf Floor,Commercial Property Bearing No.Bp-3,Main Pusa Road Old Rajinder Nagar - 110060",110060,,
Sammaan Capital,Chandigarh,Chandigarh,Chandigarh(Sco-347&348),"Sco-347-348, Sector-35-B, - 160022",160022,,
Sammaan Capital,Gujarat,Bhuj,Bhuj(Vijay_Nagar),"Off. No. 2, Mezanine Floor, Shri Swaminarayan Vaniya Sankul Hospital - 370001",370001,,
Sammaan Capital,Rajasthan,Jaipur,Jaipur(Bagru),"Plot No.17,1St Floor, Shree Balaji Plaza, Badi Ka Kehda Dakbel - 303007",303007,,
Sammaan Capital,Andhra Pradesh,Kurnool,Kurnool(Park_Road),"Medum Compound, Park Road, D.No: 40/29-X-9-4E, 4Th Floor, S.P. Squa - 518001",518001,,
Sammaan Capital,Haryana,Rohtak,Rohtak(Civil_Road),"1St Floor,Bearing No.120-121 Civil Road,Delhi-Rohtak Road - 124001",124001,,
Sammaan Capital,Punjab,Roopnagar,Ropar(Scf-41_1St_Floor),"Scf No. 41, Above Octave Store, Bela Chowk, - 140113",140113,,
Sammaan Capital,Rajasthan,Barmer,Barmer(Laxmi_Nagar),"Bearing Ward No.33,Ray Colony Road Laxmi Nagar,Barmer Goswami Tower,1St Floor, Opp.Cmho Office, - 344001",344001,,
Sammaan Capital,Punjab,Bathinda,"Goniana Road, Bathinda","First Floor, Aura Heights Above Dena Bank Near Teen Koni Chowk , Goniana Road - 151001",151001,,
Sammaan Capital,Delhi,New delhi,Lajpat Nagar,"A-34, 3Rd Floor, Lajpat Nagar-2 - 110024",110024,,
Sammaan Capital,Rajasthan,Jaipur,Jaipur(Chaksu),"2Nd Floor Above Icici Bank, New Ward No. 19, Adjoining Pwd Office,Chaksu, - 303901",303901,,
Sammaan Capital,Tamil Nadu,Chennai,T-Nagar_Apex Chambers_1St Floor,"Old No-20, Theagaraya Road, T Apex Chambers,Easten Front Si - 600017",600017,,
Sammaan Capital,Andhra Pradesh,Vijayawada,"Labbipet, Vijayawada","40-1-140/3 Sri Pothuri Towers 3Rd Floor Above Airt M.G.Road, Labbipet - 520010",520010,,
Sammaan Capital,Tamil Nadu,Chennai,Chennai(Anna_Nagar_West_Woods),"2Nd Floor,?West Woods?, ?Y Block?,New No. 32(Old No. 205), 5Th Avenue,Anna Nagar, - 600040",600040,,
Sammaan Capital,Madhya Pradesh,Dewas,Dewas(A_B_Road),"Tilak Nagar,A.B.Road, Malwa Shehnai Complex,Ug Floor, - 455001",455001,,
Sammaan Capital,Madhya Pradesh,Gwalior,Gwalior(Anand_Deep),"Office No.S-9,2Nd Floor, Anand Deep,Plot No.43, City Center - 474011",474011,,
Sammaan Capital,Himachal Pradesh,Shimla,Shimla(Ish_Niketan),"3Rd Floor,Ish Niketan,New Lands Estate, Circular Road - 171001",171001,,
Sammaan Capital,Rajasthan,Chittorgarh,Chittorgarh(Mrps_Marg),"Of Plot No.17,Kailash Nagar ,Maha Rana Pratap Setu Marg, 2Nd Floor Of Commercial Complex On Part - 312001",312001,,
Sammaan Capital,Gujarat,Junagadh,Junagarh(Trident_Plaza),"Office No.309, 3Rd Floor, Trident Plaza, Off. Zanzarda Road - 362001",362001,,
Sammaan Capital,Haryana,Rewari,Rewari(Brass_Market_Sco-25),"Ist Floor,Sco-25,Sector-8,Brass Market Urban Estate,Rewari - 123401",123401,,
Sammaan Capital,Tamil Nadu,Chennai,Chennai(Manglam_Plaza),"Mgr Main Road Perungudi Kandhanchavadi Gd,1St And2Nd Floor, Mangalam Plaza 226/ - 607106",607106,,
Sammaan Capital,Tamil Nadu,Salem,Salem(Ram_Laxman_Tower),"No.5F, Sriram Ramnagar ,Algapuram 1St Floor,Ram Laxman Tower, - 636016",636016,,
Sammaan Capital,Gujarat,Godhra,Godhra(Lic_Road),"Officeno. 27-28, Ist Floor,Guruprasad Complex,Lic Road, - 389001",389001,,
Sammaan Capital,Gujarat,Valsad,Vapi(Solitaire),"Office No.Sb-1,2Nd Floor,Building B Solitaire Business Centre Block/Survey No.4110, - 396191",396191,,
Sammaan Capital,Telangana,Warangal,Warangal(J_P_N_Road),"8-12-149,D.S.Temple Street,J.P.N.Road, - 506002",506002,,
Sammaan Capital,Maharashtra,Mumbai,Mumbai(Badlapur_Shreeji_Center),"Shop No.115,116,117&118, Shreeji Center, Ghorpade Chowk, Katrap, - 421503",421503,,
Sammaan Capital,Maharashtra,Mumbai,Borivali(Ganjawala_Lane),"Ground & First Floor, Shop No. 7, Jalaram Business Center, Ganjawala Lane, Borivali (West), - 400092",400092,,
Sammaan Capital,Maharashtra,Ratnagiri,Ratnagiri(Shivajinagar),"2Nd Floor,Infinity Plaza,Siddhivinayak Nagar, Kolhapur-Ratnagiri Highway, Shivajinagar - 415612",415612,,
Sammaan Capital,Haryana,Panchkula,Pinjore(Laljeet_Complex_Bus_Stand),"2Nd Floor,Laljeet Complex, Nh-22 Bus Stand,Pinjore, - 134102",134102,,
Sammaan Capital,Rajasthan,Jaipur,Jaipur(Jagatpura),"P. No - 3, Vishnupuri Main Jagatpura Road Jagatpura - 302017",302017,,
